{"aggregate_counts":{"accepted_karen_minimum":0,"contract_fixture_valid":4,"invalid_contract":16,"legacy_input":3,"other_ai_generated_reviewed":0,"real_user_current_valid":0},"batch001_status":"not_created_post_step2_transition","body_free":true,"collections":[{"app_reachable_valid_count":4,"case_count":4,"classification":"karen_generated","collection_id":"step2_contract_valid","corpus_ref":"ai/tests/fixtures/emlis_nls_v3/contract/valid_v1.jsonl","corpus_sha256":"0f5a6a25f93fb6ee4a155c6f85e51db828375a50667995d6af587941c1d020c0","counts_toward_karen_minimum":false,"private_commitment_policy":"none_repo_safe_synthetic","provenance_subtype":"contract_fixture_only","raw_body_in_registry":false,"status":"available_contract_fixture","storage":"repo_safe_synthetic_fixture"},{"app_reachable_valid_count":0,"case_count":16,"classification":"invalid_contract","collection_id":"step2_invalid_contract","corpus_ref":"ai/tests/fixtures/emlis_nls_v3/contract/invalid_v1.jsonl","corpus_sha256":"d7cbc344701635d53da21ebb2814a9c8d814cf1c403392b506ece6c00e6e5b77","counts_toward_karen_minimum":false,"private_commitment_policy":"none_repo_safe_synthetic","provenance_subtype":"synthetic_negative_contract_fixture","raw_body_in_registry":false,"status":"available_contract_fixture","storage":"repo_safe_synthetic_fixture"},{"app_reachable_valid_count":0,"case_count":3,"classification":"legacy_input","collection_id":"step2_legacy_input","corpus_ref":"ai/tests/fixtures/emlis_nls_v3/contract/legacy_v1.jsonl","corpus_sha256":"e61614561986f92ead55aa830e4c4a0e32932dfbc1fe4d02b7ba4cb9aa7b1db6","counts_toward_karen_minimum":false,"private_commitment_policy":"none_repo_safe_synthetic","provenance_subtype":"synthetic_real_user_legacy","raw_body_in_registry":false,"status":"available_contract_fixture","storage":"repo_safe_synthetic_fixture"},{"app_reachable_valid_count":0,"case_count":0,"classification":"real_user_current_valid","collection_id":"real_user_current_valid","corpus_ref":null,"corpus_sha256":null,"counts_toward_karen_minimum":false,"private_commitment_policy":"hmac_sha256_private_key_required","provenance_subtype":"supabase_not_received","raw_body_in_registry":false,"status":"not_received","storage":"private_local_only"}],"completion_condition":"strict_schema_validator_duplicate_registry_annotation_guard_green","cumulative_novelty_index":{"accepted_batch_refs":[],"accepted_karen_case_count":0,"exact_input_identities":["3a8cce9cc6b846b697018a6b2da894b75db40bd207318133be3dff47b82db9ec","53fcb3d02147508917396ba2c7a7381aded2343acc00b1725d630b34307dde4d","8336642ad55846b35206c481d8eae99298706cd9e9d826bce0c8f36597f36023","ed683f5cfd3b0f9842523ffa1a9b299777922e0f9dc3f359e20274be44eaa1f4"],"identity_scope":"repo_safe_synthetic_only_private_sources_require_hmac","normalized_input_identities":["3a8cce9cc6b846b697018a6b2da894b75db40bd207318133be3dff47b82db9ec","53fcb3d02147508917396ba2c7a7381aded2343acc00b1725d630b34307dde4d","8336642ad55846b35206c481d8eae99298706cd9e9d826bce0c8f36597f36023","ed683f5cfd3b0f9842523ffa1a9b299777922e0f9dc3f359e20274be44eaa1f4"],"reference_case_count":4,"registered_case_ids":["nls3s_b000_0001","nls3s_b000_0002","nls3s_b000_0003","nls3s_b000_0004"],"replacement_case_id_reuse_allowed":false,"retired_invalid_case_ids":[]},"design_sha256":"6aa3fb799919ac30b0eb84571ac4009d62a2bd799c84322272a59bba533f13bc","next_step_authority":"create_and_freeze_batch001_then_step3_only","parent_step1_ref":"ai/tests/fixtures/emlis_nls_v3_s1_baseline_receipt_20260714.json","parent_step1_sha256":"669835b0fdce3bc1e2e897325ab37b5f82abc9a353bc864993aa284083b7a518","policies":{"annotation_projection":"explicit_input_allowlist_only","duplicate_policy_sha256":"4293727873d829c98c2e4c6aff947c2d15b048989a06046f0e7f988f75f116c2","private_real_user_identity":"versioned_domain_separated_hmac_private_key","raw_real_user_repo_allowed":false,"validator_policy_sha256":"cca85dafcf338637e2338e47306ce4b4c9c7ad18c98ae1bd89935313cc8c7d39"},"registry_id":"nls3registry_99942b181f22f479","schema_version":"cocolon.emlis.nls_v3.corpus_registry.v1","schemas":[{"ref":"ai/tests/schemas/emlis_nls_v3_sample_case_v1.schema.json","role":"sample_case","sha256":"90d569460f05aa7347145ba1562754c1304fe4b4878165b5bfbb1180cf9087ef"},{"ref":"ai/tests/schemas/emlis_nls_v3_coverage_matrix_v1.schema.json","role":"coverage_matrix","sha256":"1e0f31277fd008759e221d0c60ce589ecaede74dfcd55f49002dccd0a68a5c4c"},{"ref":"ai/tests/schemas/emlis_nls_v3_sample_batch_manifest_v1.schema.json","role":"sample_batch_manifest","sha256":"439a64bd457d547bb530922be0d6273d1415783c15fea31f1b618a924035cdae"},{"ref":"ai/tests/schemas/emlis_nls_v3_corpus_registry_v1.schema.json","role":"corpus_registry","sha256":"d28fe0045a393965c4637a320fa98fc1b23c632ca1dd75888a0925d9e61d6c62"}],"step2_status":"completed","test_evidence":{"independent_negative_fixture_count":16,"legacy_fixture_count":3,"live_completion_probes_passed":true,"positive_fixture_count":4,"required_test_contracts":["app_reachable_positive_and_independent_negative","rn_contract_and_hash_drift","canonical_json_and_jsonl_adversarial","exact_normalized_near_and_order_determinism","schema_runtime_parity","annotation_projection_allowlist","private_hmac_and_shareable_source_boundary","coverage_manifest_registry_recomputation","batch001_100_case_transition_boundary","invalid_replacement_lineage_and_retired_id_nonreuse"],"test_ref":"ai/tests/test_emlis_nls_v3_s2_sample_registry.py","test_sha256":"3ef4753f1f7cb24cbb73c96161d68fac189109da313c746736d46fb39f1ad3e9"},"valid_for_batch001_creation":true,"valid_for_runtime_switch":false,"validator_owner":{"ref":"ai/tests/helpers/emlis_nls_v3_s2_sample_registry.py","sha256":"cf4f048258c92ccad8d99ee8af4926f1a5730682ae772b9d44a16fc302ff9b6d"}}
